id,text,category
1,"The company announced a new AI-powered tool designed to improve productivity across teams.",tech
2,"The local team secured a last-minute victory in the championship final.",sports
3,"Stock markets saw a significant drop amid global economic concerns.",business
4,"The government introduced new policies aimed at reducing carbon emissions.",politics
5,"Doctors recommend regular exercise to improve cardiovascular health.",health
6,"A breakthrough in quantum computing could transform modern encryption.",tech
7,"The star player scored a record number of goals this season.",sports
8,"Several startups are attracting investors despite economic uncertainty.",business
9,"The election campaign focused heavily on healthcare and education reforms.",politics
10,"A balanced diet plays a critical role in maintaining mental health.",health
11,"Cybersecurity experts warn of increasing ransomware attacks worldwide.",tech
12,"The coach emphasized teamwork after the disappointing loss.",sports
13,"Retail sales increased during the holiday season, boosting profits.",business
14,"Parliament debated the new infrastructure development bill.",politics
15,"Researchers found links between sleep quality and immune function.",health
16,"New smartphone models feature advanced machine learning capabilities.",tech
17,"Fans celebrated as their team advanced to the finals.",sports
18,"The merger between the two companies created a major industry player.",business
19,"Diplomatic relations between the countries have improved.",politics
20,"Regular medical checkups help detect diseases early.",health
21,"Cloud computing adoption continues to grow among enterprises.",tech
22,"The athlete broke the world record in the 100-meter sprint.",sports
23,"Inflation rates are affecting consumer purchasing behavior.",business
24,"The administration announced reforms in public transportation.",politics
25,"Vaccination programs have reduced the spread of infectious diseases.",health
26,"Developers released a new open-source software framework.",tech
27,"The tournament attracted teams from across the globe.",sports
28,"Small businesses are adapting to digital payment systems.",business
29,"Leaders met to discuss international trade agreements.",politics
30,"Mental health awareness campaigns are increasing worldwide.",health